id,title,score,num_comments,author,created_utc,url,over_18,edited,spoiler,stickied
1e4d6sn,1st app. Golf score tracker,128,25,Fraiz24,2024-07-16 02:17:25,https://www.reddit.com/gallery/1e4d6sn,False,False,False,False
1e4wpkz,Explaining my db schema,89,5,the-driving-crooner-,2024-07-16 18:56:33,https://v.redd.it/7lzop371hxcd1,False,False,False,False
1e4kkj4,Rant: Platform Team says no,62,14,FlirtyDirtyQwerty,2024-07-16 09:45:32,https://www.reddit.com/r/dataengineering/comments/1e4kkj4/rant_platform_team_says_no/,False,False,False,False
1e4rnwp,What’s the Hello World of Data Engineering?,41,29,MrMosBiggestFan,2024-07-16 15:33:20,https://www.reddit.com/r/dataengineering/comments/1e4rnwp/whats_the_hello_world_of_data_engineering/,False,False,False,False
1e4rcjl,No automated test can compete with them,32,3,Awkward-Cupcake6219,2024-07-16 15:20:37,https://i.redd.it/t9791lubewcd1.jpeg,False,False,False,False
1e4e6b1,What is id stitching and why is it hard,24,11,ephemeral404,2024-07-16 03:06:18,https://www.reddit.com/r/dataengineering/comments/1e4e6b1/what_is_id_stitching_and_why_is_it_hard/,False,False,False,False
1e4u49w,"Best database for performance? 100M unique rows, 20k unique keys.",18,20,Notalabel_4566,2024-07-16 17:11:22,https://www.reddit.com/r/dataengineering/comments/1e4u49w/best_database_for_performance_100m_unique_rows/,False,False,False,False
1e4mfmz,Project: ELT Data Pipeline using GCP + Airflow + Docker + DBT + BigQuery. Please review.,14,2,aayomide,2024-07-16 11:39:17,https://www.reddit.com/r/dataengineering/comments/1e4mfmz/project_elt_data_pipeline_using_gcp_airflow/,False,False,False,False
1e4m3ry,Unleashing the Power of AI on Hoarded Data: How Apache Spark Transforms Enterprise Data Centers into Insight Engines by Leo Benkel,9,0,tornadolobo,2024-07-16 11:20:58,https://www.ziverge.com/post/unleashing-the-power-of-ai-on-hoarded-data-how-apache-spark-transforms-enterprise-data-centers-into-insight-engines,False,False,False,False
1e4pefb,Resumable Full Refresh: Building resilient systems for syncing data | Airbyte,5,1,arimbr,2024-07-16 14:00:38,https://airbyte.com/blog/resumable-full-refresh-building-resilient-systems-for-syncing-data,False,False,False,False
1e4lih8,Migrating off Matillion ,7,1,ryhackett,2024-07-16 10:45:53,https://www.reddit.com/r/dataengineering/comments/1e4lih8/migrating_off_matillion/,False,False,False,False
1e4iucx,Is my project idea good for a beginner? How to improve it?,6,3,Bobsthejob,2024-07-16 07:46:51,https://www.reddit.com/r/dataengineering/comments/1e4iucx/is_my_project_idea_good_for_a_beginner_how_to/,False,False,False,False
1e4vp8t,Is anyone aware of a data validation library that plays nicely with Polars?,5,7,H0twax,2024-07-16 18:15:50,https://www.reddit.com/r/dataengineering/comments/1e4vp8t/is_anyone_aware_of_a_data_validation_library_that/,False,False,False,False
1e4whco,Help in moving from a GIS ingestion tool to open source ,5,3,Sea-Independence2899,2024-07-16 18:47:15,https://www.reddit.com/r/dataengineering/comments/1e4whco/help_in_moving_from_a_gis_ingestion_tool_to_open/,False,False,False,False
1e4i4lq,Any feedback on DE workloads on HTAP in production? (Hybrid Transactional/Analytical Processing),3,1,sib_n,2024-07-16 06:59:03,https://www.reddit.com/r/dataengineering/comments/1e4i4lq/any_feedback_on_de_workloads_on_htap_in/,False,False,False,False
1e4wlvg,Education  Content Based Data Project,3,1,MathMindfully,2024-07-16 18:52:21,https://www.reddit.com/r/dataengineering/comments/1e4wlvg/education_content_based_data_project/,False,False,False,False
1e4ms4r,"Pcodec: a futuristic codec for numerical data, now in Zarr",3,2,mwlon,2024-07-16 11:58:10,https://www.reddit.com/r/dataengineering/comments/1e4ms4r/pcodec_a_futuristic_codec_for_numerical_data_now/,False,False,False,False
1e51p28,Trying to confirm my understanding of a basic layering of data.,2,5,PoireauMasque,2024-07-16 22:22:11,https://www.reddit.com/r/dataengineering/comments/1e51p28/trying_to_confirm_my_understanding_of_a_basic/,False,False,False,False
1e4xdff,Seeking Advice on Automating Email Campaign for Product Launch Using Azure Tech Stack or other free or cheap options ,2,1,mysterious_code,2024-07-16 19:23:27,https://www.reddit.com/r/dataengineering/comments/1e4xdff/seeking_advice_on_automating_email_campaign_for/,False,False,False,False
1e4r7v2,Let's discuss optimizations when volume of data is shot in the dark. New to DE and feeling lost ,2,3,sophisticationmiss,2024-07-16 15:15:24,https://www.reddit.com/r/dataengineering/comments/1e4r7v2/lets_discuss_optimizations_when_volume_of_data_is/,False,False,False,False
1e4nc3u,Python UDFs in Snowflake,4,0,Datafluent,2024-07-16 12:26:02,https://i.redd.it/f9pma2y9jvcd1.png,False,False,False,False
1e4dgmg,Linked Servers,4,5,Lurch1400,2024-07-16 02:31:09,https://www.reddit.com/r/dataengineering/comments/1e4dgmg/linked_servers/,False,False,False,False
1e54bsv,Thoughts on DataCamp 'Big Data with PySpark' Specialization? Will this be enough for learning PySpark?,3,6,altered-perceptions,2024-07-17 00:19:23,https://www.reddit.com/r/dataengineering/comments/1e54bsv/thoughts_on_datacamp_big_data_with_pyspark/,False,False,False,False
1e4yt5e,Has anyone ever worked with the Workday HCM table schema in Snowflake via Fivetran integration?,1,0,nidenikolev,2024-07-16 20:22:08,https://www.reddit.com/r/dataengineering/comments/1e4yt5e/has_anyone_ever_worked_with_the_workday_hcm_table/,False,False,False,False
1e4yr1e,"Scraping, data engineering and SaS",1,1,Different_Fee6785,2024-07-16 20:19:45,https://www.reddit.com/r/dataengineering/comments/1e4yr1e/scraping_data_engineering_and_sas/,False,False,False,False
1e4r13a,Balancing solving business problems and tool proficiency,1,3,Tough_Bag_458,2024-07-16 15:07:40,https://www.reddit.com/r/dataengineering/comments/1e4r13a/balancing_solving_business_problems_and_tool/,False,False,False,False
1e4p89o,Which offer should I pick if my end goal is to become a data engineer as soon as possible?,1,7,Information-Famous,2024-07-16 13:53:22,https://www.reddit.com/r/dataengineering/comments/1e4p89o/which_offer_should_i_pick_if_my_end_goal_is_to/,False,False,False,False
1e4o8pp,Data Extraction Tools,1,2,Puzzleheaded_Dot7177,2024-07-16 13:09:28,https://www.reddit.com/r/dataengineering/comments/1e4o8pp/data_extraction_tools/,False,False,False,False
1e4s9y6,Core Components for an Effective Data Mesh Strategy,0,0,secodaHQ,2024-07-16 15:58:34,https://www.reddit.com/r/dataengineering/comments/1e4s9y6/core_components_for_an_effective_data_mesh/,False,False,False,False
1e4p0g0,Building a community ,0,0,xcxzero,2024-07-16 13:43:58,https://chat.whatsapp.com/BoTY6Ynn7h5JeichU8Ybcb,False,False,False,False
1e4l4f0,Book on Fivetran,0,0,groVpckt,2024-07-16 10:20:55,https://www.reddit.com/r/dataengineering/comments/1e4l4f0/book_on_fivetran/,False,False,False,False
1e5055q,What's the catch behind DE?,0,16,Mobile-Print-3138,2024-07-16 21:16:20,https://www.reddit.com/r/dataengineering/comments/1e5055q/whats_the_catch_behind_de/,False,False,False,False
