id,title,score,num_comments,author,created_utc,url,over_18,edited,spoiler,stickied
1e3y2re,Your dream data Architecture,86,59,bancaletto,2024-07-15 15:46:01,https://www.reddit.com/r/dataengineering/comments/1e3y2re/your_dream_data_architecture/,False,False,False,False
1e45med,How often do stakeholders think they are special?,53,12,ivanovyordan,2024-07-15 20:42:11,https://i.redd.it/tcmqddevuqcd1.jpeg,False,False,False,False
1e3n522,Economical data warehouse based on Parquet in GCP Storage,37,26,GreymanTheGrey,2024-07-15 05:40:00,https://www.reddit.com/r/dataengineering/comments/1e3n522/economical_data_warehouse_based_on_parquet_in_gcp/,False,False,False,False
1e4686z,Anyone work a government job in the US as a DE?,22,4,citizenofacceptance2,2024-07-15 21:05:57,https://www.reddit.com/r/dataengineering/comments/1e4686z/anyone_work_a_government_job_in_the_us_as_a_de/,False,False,False,False
1e3mw63,Building a real-time personalization engine,13,0,ephemeral404,2024-07-15 05:24:48,https://i.redd.it/m1fphhfabmcd1.png,False,False,False,False
1e3u406,Cloud warehouse bills,15,13,Front_Veterinarian53,2024-07-15 12:56:01,https://www.reddit.com/r/dataengineering/comments/1e3u406/cloud_warehouse_bills/,False,False,False,False
1e47pij,"With zero experience, what's fair entry-level pay?",14,36,pm_me_data_wisdom,2024-07-15 22:05:47,https://www.reddit.com/r/dataengineering/comments/1e47pij/with_zero_experience_whats_fair_entrylevel_pay/,False,False,False,False
1e4d6sn,1st app. Golf score tracker,10,0,Fraiz24,2024-07-16 02:17:25,https://www.reddit.com/gallery/1e4d6sn,False,False,False,False
1e3nt51,Would you use a Data Engineer focused CoPilot?,9,37,Bright_Bunch_7208,2024-07-15 06:22:43,https://www.reddit.com/r/dataengineering/comments/1e3nt51/would_you_use_a_data_engineer_focused_copilot/,False,False,False,False
1e415ze,New to databricks and snowflakes,7,4,Far-Mixture-2254,2024-07-15 17:47:21,https://www.reddit.com/r/dataengineering/comments/1e415ze/new_to_databricks_and_snowflakes/,False,False,False,False
1e47x6x,What are your DE horror stories and feats?,7,8,Icy_Clench,2024-07-15 22:14:47,https://www.reddit.com/r/dataengineering/comments/1e47x6x/what_are_your_de_horror_stories_and_feats/,False,False,False,False
1e42iqn,Free Sample Data Generator,5,4,ExploAnalytics,2024-07-15 18:41:07,https://www.reddit.com/r/dataengineering/comments/1e42iqn/free_sample_data_generator/,False,False,False,False
1e3uc5v,Tearing Down the Monolith | The Rise of Microservices & Modular Architecture in Data Engineering,5,1,growth_man,2024-07-15 13:06:38,https://moderndata101.substack.com/p/tearing-down-monolith-the-rise-of-microservices,False,False,False,False
1e3q21m,Designing Platform Logging Pipeline,5,4,DifficultyNo3182,2024-07-15 08:55:22,https://www.reddit.com/r/dataengineering/comments/1e3q21m/designing_platform_logging_pipeline/,False,False,False,False
1e3qc87,Glue Visual Studio Help,3,2,Free-Way-5831,2024-07-15 09:14:19,https://www.reddit.com/r/dataengineering/comments/1e3qc87/glue_visual_studio_help/,False,False,False,False
1e48tyn,Data Fabric vs Data Warehouse,2,0,letsgopablo,2024-07-15 22:53:50,https://www.reddit.com/r/dataengineering/comments/1e48tyn/data_fabric_vs_data_warehouse/,False,False,False,False
1e47wv7,Resources to quickly grasp GCP and SQL/MLOps knowledge coming from ML research and Data Scientist position,2,2,howtorewriteaname,2024-07-15 22:14:23,https://www.reddit.com/r/dataengineering/comments/1e47wv7/resources_to_quickly_grasp_gcp_and_sqlmlops/,False,False,False,False
1e4717d,DE Junior responsible for implement all Microsoft Fabric enviroment,2,3,chongsurfer,2024-07-15 21:38:07,https://www.reddit.com/r/dataengineering/comments/1e4717d/de_junior_responsible_for_implement_all_microsoft/,False,False,False,False
1e45swt,Seeking Advice: Partner Companies vs. In-House Development for a Sensor-Based Data Collection System,2,3,dr_danthebandageman,2024-07-15 20:49:25,https://www.reddit.com/r/dataengineering/comments/1e45swt/seeking_advice_partner_companies_vs_inhouse/,False,False,False,False
1e457gw,Databricks UC / DLT - Confusion....,2,2,RaisinAccurate1278,2024-07-15 20:25:43,https://www.reddit.com/r/dataengineering/comments/1e457gw/databricks_uc_dlt_confusion/,False,False,False,False
1e430af,MySQL-to-Snowflake and PostgreSQL-to-Snowflake native connectors!,2,1,feelosophy13,2024-07-15 19:00:34,https://www.reddit.com/r/dataengineering/comments/1e430af/mysqltosnowflake_and_postgresqltosnowflake_native/,False,False,False,False
1e3wz5i,Top 5 Airflow Alternatives for Data Orchestration (Code Examples Included),3,1,kingabzpro,2024-07-15 15:02:02,https://www.datacamp.com/blog/airflow-alternatives,False,False,False,False
1e4dgmg,Linked Servers,2,2,Lurch1400,2024-07-16 02:31:09,https://www.reddit.com/r/dataengineering/comments/1e4dgmg/linked_servers/,False,False,False,False
1e49e8d,Data Analyst or Not: Understanding Your Market Research Role,1,0,igz16,2024-07-15 23:18:25,https://www.reddit.com/r/dataengineering/comments/1e49e8d/data_analyst_or_not_understanding_your_market/,False,False,False,False
1e46lta,snowflake table to postgres,1,1,Sea-Forever3053,2024-07-15 21:21:08,https://www.reddit.com/r/dataengineering/comments/1e46lta/snowflake_table_to_postgres/,False,False,False,False
1e46j3c,Seeking advice in data engineer carreer,1,0,SensitiveCucumber0,2024-07-15 21:18:10,https://www.reddit.com/r/dataengineering/comments/1e46j3c/seeking_advice_in_data_engineer_carreer/,False,False,False,False
1e420vl,Stuck with legacy data tech,1,2,photon223,2024-07-15 18:21:30,https://www.reddit.com/r/dataengineering/comments/1e420vl/stuck_with_legacy_data_tech/,False,False,False,False
1e3walc,Would it make sense to use these tools in this context? ,1,6,LlosgiTaiBraf,2024-07-15 14:33:35,https://www.reddit.com/r/dataengineering/comments/1e3walc/would_it_make_sense_to_use_these_tools_in_this/,False,False,False,False
1e3wlbk,Python UDFs in Snowflake,0,0,Datafluent,2024-07-15 14:46:22,https://www.reddit.com/r/dataengineering/comments/1e3wlbk/python_udfs_in_snowflake/,False,False,False,False
1e42o3l,Real time Monitoring dashboard 🚀,0,11,Far-Mixture-2254,2024-07-15 18:47:02,https://www.reddit.com/r/dataengineering/comments/1e42o3l/real_time_monitoring_dashboard/,False,False,False,False
